{
  "schema_version": "1.0.0",
  "solution_id": "sol_05_incompatible",
  "order_id": "FIX-05",
  "status": "solved",
  "solver": {
    "version": "0.1.0",
    "seed": 12555962309569321414,
    "mode": "rigid",
    "time_budget_ms": 1200,
    "elapsed_ms": 0,
    "tier": 1
  },
  "coordinate_system": {
    "up": "z",
    "handedness": "right",
    "origin": "min_corner"
  },
  "units": {
    "length": "mm",
    "mass": "g"
  },
  "metrics": {
    "carton_count": 2,
    "fill_rate": 0.102,
    "total_mass": 1890
  },
  "cartons": [
    {
      "carton_id": "c1",
      "sku": "BOX-S",
      "inner_dims": [
        220,
        160,
        120
      ],
      "tare_mass": 120,
      "contents_mass": 1200,
      "fill_rate": 0.1212,
      "centre_of_mass": [
        40,
        40,
        40
      ],
      "placements": [
        {
          "placement_id": "p1_0",
          "item_ref": "MAGNET",
          "label": "Magnet set",
          "position": [
            0,
            0,
            0
          ],
          "dims": [
            80,
            80,
            80
          ],
          "orientation": 0,
          "mass": 1200,
          "sequence": 0,
          "tags": []
        }
      ]
    },
    {
      "carton_id": "c2",
      "sku": "BOX-S",
      "inner_dims": [
        220,
        160,
        120
      ],
      "tare_mass": 120,
      "contents_mass": 450,
      "fill_rate": 0.0829,
      "centre_of_mass": [
        70,
        50,
        12
      ],
      "placements": [
        {
          "placement_id": "p2_0",
          "item_ref": "HDD",
          "label": "Hard drive",
          "position": [
            0,
            0,
            0
          ],
          "dims": [
            140,
            100,
            25
          ],
          "orientation": 0,
          "mass": 450,
          "sequence": 0,
          "tags": []
        }
      ]
    }
  ],
  "rejects": []
}